job_number,address,address_house,address_street,latitude,longitude,ycoord,xcoord,bin,bbl,boro,block,lot,dob_type,job_type,job_description,dcp_occ_category,occ_init,occ_prop,dob_occ_init,dob_occ_prop,dcp_status,dob_status,status_date,status_a,status_a_year,status_d,status_p,status_q,status_q_year,status_r,status_x,dob_bldg_type,stories_init,stories_prop,zoningsft_init,zoningsft_prop,units_init,units_prop,units_net,units_net_complete,units_net_incomplete,earliest_effectivedate,latest_effectivedate,latest_certtype,latest_cofo,u_2007_existtotal,u_2008_existtotal,u_2009_existtotal,u_2010pre_existtotal,u_2010post_existtotal,u_2011_existtotal,u_2012_existtotal,u_2013_existtotal,u_2014_existtotal,u_2015_existtotal,u_2016_existtotal,u_2017_existtotal,u_2018_existtotal,unit_change_2007,unit_change_2008,unit_change_2009,unit_change_preapr2010,unit_change_postapr2010,unit_change_2011,unit_change_2012,unit_change_2013,unit_change_2014,unit_change_2015,unit_change_2016,unit_change_2017,unit_change_2018,u_2007_netcomplete,u_2008_netcomplete,u_2009_netcomplete,u_2010pre_netcomplete,u_2010post_netcomplete,u_2011_netcomplete,u_2012_netcomplete,u_2013_netcomplete,u_2014_netcomplete,u_2015_netcomplete,u_2016_netcomplete,u_2017_netcomplete,u_2018_netcomplete,geo_cd,geo_ntacode,geo_ntaname,geo_censusblock,geo_csd,f_pfirms2015_100yr,x_dcpedited,x_mixeduse,x_dup_flag,x_dup_id,x_dup_maxstatusdate,x_dup_maxcofodate,x_geomsource,x_occsource,x_inactive,x_outlier,x_withdrawal,geom,flag,outlier
104177481,201 WEST 92 STREET,201,WEST 92 STREET,40.791588,-73.972423,,,1033613,1012400002,MANHATTAN,01240,00029,A1,Alteration,"PROPOSE TO CONSTRUCT A 9 STORY ADDITIONUPON EXISTING 6 STORY BUILDING F OR APRTMENT USE. EXTEND EXISTING ELEVATORS AND NEW INTERIO STAIRS. RELATED MECHA NICAL, PLUMBING AND STURCTURAL WORK WILLBE FILE AS SEPARATE DOCUMENTS OF THIS AP PLICATION. ESTIMATED COST INCLUDES ALL WORK FOR ALL DOCUMENTS. A NEW C OF O",Residential,Residential,Residential: Multi-Family,RES,J-2,Disapproved,PLAN EXAM - DISAPPROVED,12/19/2008 12:00:00 AM,07/25/2005,2005,07/27/2005,12/19/2008,,,,,OTHERS,0,16,0,0,,99,,,,,,,,,,,,,,,,,,,,,,,,,,,,,,,,,,,,,,,,,,,,,,,,,,,,,,,,,,,,,,,W,,top 10 units_prop A1,
121109576,21 SPRING STREET,21,SPRING STREET,40.721488,-73.995115,,,1007484,1004930004,MANHATTAN,00493,00041,A1,Alteration,ALT 1 FILED FOR 'NO WORK'.  THIS BEING FILED TO SUBDIVIDE THE TAX LOT & OBTAIN A NEW CERTIFICATE OF OCCUPANCY FOR THE VANCANT PORTION.,Residential,Residential,Residential: Multi-Family,RES,R-2,Application filed,PLAN EXAM - APPROVED,08/03/2012 12:00:00 AM,06/11/2012,2012,06/11/2012,08/03/2012,,,,,OTHERS,999,999,183826,183826,9999,9999,0,0,,,,,,9999,9999,9999,9999,9999,9999,9999,9999,9999,9999,9999,9999,9999,0,0,0,0,0,0,0,0,0,0,0,0,0,9999,9999,9999,9999,9999,9999,9999,9999,9999,9999,9999,9999,9999,,,,,,,,,,,,,,,,,N,,top 10 units_prop A1,
121186821,49 CHAMBERS ST,49,CHAMBERS ST,40.713767,-74.005429,,,1079216,1001530001,MANHATTAN,00153,00018,A1,Alteration,ALTERATION TYPE 1 FOR CONVERSION OF EXISTING BUILDING,Residential,Commercial,Residential: Multi-Family,E,R-2,Permit issued,PERMIT ISSUED - ENTIRE JOB/WORK,05/25/2018 12:00:00 AM,08/28/2014,2014,09/02/2014,11/17/2015,2016-06-08,2016,01/11/2017,,OTHERS,15,15,224907,220860,,99,,,,,,,,,,,,,,,,,,,,,,,,,,,,,,,,,,,,,,,,,,,,,,,,,,,,,,,,,,,,,,,N,,top 10 units_prop A1,
310230568,1971 86 STREET,1971,86 STREET,40.604904,-73.998722,,,3165806,3063450004,BROOKLYN,06345,00040,A1,Alteration,FILING TO OBTAIN NEW CERTIFICATE OF OCCUPANCY. CLOSE EXISTING DEMISING WALL.,Other,Retail,Retail,C,M,Permit issued,PERMIT ISSUED - ENTIRE JOB/WORK,11/10/2016 12:00:00 AM,12/12/2008,2008,12/12/2008,05/10/2012,2016-11-10,2016,11/10/2016,,OTHERS,2,2,2620,1000,9999,9999,0,0,,,,,,9999,9999,9999,9999,9999,9999,9999,9999,9999,9999,9999,9999,9999,0,0,0,0,0,0,0,0,0,0,0,0,0,9999,9999,9999,9999,9999,9999,9999,9999,9999,9999,9999,9999,9999,,,,,,,,,,,,,,,,,N,,top 10 units_prop A1,
320012525,143 ROEBLING STREET,143,ROEBLING STREET,40.714360,-73.957644,,,3251737,3023680000,BROOKLYN,02368,00001,A1,Alteration,"CONVERT EXISTING MANUFACTURING BUILDING TO RESIDENTIAL USE MAINTAIN PORTIONS OF EXISTING COMMERCIAL SPACE AS EXISTING NON CONFORMING USE,  OBTAIN A NEW   C OF O.",Residential,Commercial,Residential: Multi-Family,COM,R-2,Application filed,PLAN EXAM - APPROVED,10/07/2011 12:00:00 AM,05/01/2009,2009,05/05/2009,10/07/2011,,,,,OTHERS,6,6,117950,117950,0,90,90,0,,,,,,0,0,0,0,0,0,0,0,0,0,0,0,0,0,0,0,0,0,0,0,0,0,0,0,0,0,-90,-90,-90,-90,-90,-90,-90,-90,-90,-90,-90,-90,-90,,,,,,,,,,,,,,,,,N,,top 20 units_net A1,
